<?xml version="1.0" encoding="ISO-8859-1"?>
<Site 
    xmlns:xsi="http://www.w3.org/2001/XMLSchema-instance" 
    xsi:schemaLocation="..\schema\Roloflex.xsd">
    <Destination Name="Default">
        <Site>kojami</Site>
        <Processes><!-- Not specifying if it is put or get -->
            <Process>
                <Tag>Configuration Files : Application.xml</Tag>
                <LCD>B:\SOURCES\Repos\Roloflex\config</LCD>
                <CD>/var/www/site/Roloflex/config</CD>
                <Package>Application.xml</Package>
            </Process>
            <Process>
                <Tag>Configuration File : Env.xml</Tag>
                <LCD>B:\SOURCES\Repos\Roloflex\config</LCD>
                <CD>/var/www/site/Roloflex/config</CD>
                <Package>Env.xml</Package>
            </Process>
            <Process>
                <Tag>import files</Tag>
                <LCD>B:\SOURCES\Repos\Roloflex</LCD>
                <CD>/var/www/site/Roloflex</CD>
                <Package>imports</Package>
            </Process>
        </Processes>
    </Destination>
</Site>